{
  "schema_version": 2,
  "generated_at": "2026-04-23T14:12:14.106Z",
  "benchmark_root": "benchmark",
  "status": "ok",
  "run_count": 1,
  "run_index": [
    {
      "run_id": "run-20260422T000000Z-codex-gpt-5.4-scaffold",
      "path": "benchmark/runs/sample-empty-run",
      "host": "codex",
      "model": "gpt-5.4",
      "variant": "scaffold",
      "status": "complete",
      "created_at": "2026-04-22T00:00:00.000Z",
      "task_counts": {
        "total": 0,
        "scored": 0,
        "failed": 0
      },
      "averages": {
        "route_correctness": null,
        "reasoning_quality": null,
        "validation_completeness": null,
        "final_correctness": null,
        "risk_handling_quality": null
      },
      "failure_breakdown": {
        "route": 0,
        "depth": 0,
        "tool": 0,
        "host": 0,
        "none": 0
      },
      "files": {
        "run_meta": true,
        "scorecard": true,
        "results_ndjson": true,
        "notes": true
      }
    }
  ],
  "comparison_views": {
    "base_vs_base_plus_skills": [],
    "base_plus_skills_vs_stronger_model": []
  },
  "notes": "Generated by benchmark/scripts/generate-summary.js"
}
